URL,Title,EV_Content
https://www.carwale.com/new/electric-cars/,"Electric Cars in India - April 2025 | Electric Car Prices, Images - CarWale","Electric Cars in India - April 2025 | Electric Car Prices, Images - CarWale NEW CARS USED CARS REVIEWS & NEWS Electric Cars Are you planning on buying a electric car? Well, 
                    we know that fuel type is one of the most crucial things while buying a car and with so many options available out there, 
                    it gets really difficult to find a good car which suits your pocket. Hence, we have put together a complete list of best electric cars. 
                    Mahind"
https://www.carwale.com/,"New Cars, Used Cars, Buy a Car, Sell Your Car - CarWale","New Cars, Used Cars, Buy a Car, Sell Your Car - CarWale NEW CARS USED CARS REVIEWS & NEWS Find Your Right Car Select City Type to select car name, e.g. Citroen Basalt Search City e.g. Mumbai New New Used Type to select car name, e.g. Citroen Basalt Search City e.g. Mumbai XUV700 Creta Curvv Tiguan R-Line Urban Cruiser Hyryder BE 6 Scorpio N Brezza Grand Vitara Explore New Cars Buy Used Cars in Mumbai Bangalore Delhi Pune Navi Mumbai Mumbai Bangalore Delhi Pune Navi Mumbai Sell Car | Check Car Va"
https://www.carwale.com/mahindra-cars/be-6/#variants,"Mahindra BE 6E Price - Images, Colours & Reviews - CarWale","Mahindra BE 6E Price - Images, Colours & Reviews - CarWale NEW CARS USED CARS REVIEWS & NEWS AD Mahindra BE 6 3.8 Expert Rating | 4.7 User Rating (203) Rate & Win The BE 6 is Mahindra's first born-electric vehicle, built on an advanced INGLO platform designed for electric vehicles. It is a new coupe-style SUV that combines the latest technology with high efficiency and strong performance. ...more Overview Variants Offers Similar Cars Colours Brochure Range User Reviews News Expert Reviews Videos"
https://www.carwale.com/tata-cars/nexon-ev/#variants,"Tata Nexon EV Price - Images, Colours & Reviews - CarWale","Tata Nexon EV Price - Images, Colours & Reviews - CarWale NEW CARS USED CARS REVIEWS & NEWS AD Tata Nexon EV 3.7 Expert Rating | 4.3 User Rating (130) Rate & Win The Nexon EV, an electric SUV, has impressive range, swift acceleration, and ample interior space. Apart from that, the good ride and handling, sleek design, fast charging capability, and advanced features like regenerative braking make it a compelling choice. ...more Overview 360째 View Variants Offers Similar Cars Colours Brochure Rang"
https://www.carwale.com/mahindra-cars/xev-9e/#variants,"Mahindra XEV 9e Price - Images, Colours & Reviews - CarWale","Mahindra XEV 9e Price - Images, Colours & Reviews - CarWale NEW CARS USED CARS REVIEWS & NEWS AD Mahindra XEV 9e 3.9 Expert Rating | 4.8 User Rating (83) Rate & Win The XEV 9e is be a brand-new coupe SUV underpinned by the new Born Electric vehicle INGLO platform. It is loaded with many segment-leading features. The electric coupe SUV has been launched with an introductory price tag of Rs. 21.9 lakh (ex-showroom). ...more Overview Variants Offers Similar Cars Colours Brochure Range User Reviews "
https://www.carwale.com/tata-cars/curvv-ev/#variants,"Tata Curvv EV Price - Images, Colours & Reviews - CarWale","Tata Curvv EV Price - Images, Colours & Reviews - CarWale NEW CARS USED CARS REVIEWS & NEWS AD Tata Curvv EV 4.4 User Rating (63) Rate & Win The price of Tata Curvv EV, a SUV Coupe, ranges from Rs. 17.49  - 22.24 Lakh. It is available in 8 variants. Curvv EV has an NCAP rating of 5 stars. Tata Curvv EV has a ground clearance of 190 mm  and is available in 5 colours. Users have reported a driving range of 471.14 km for Curvv EV. ...more Overview 360째 View Variants Offers Key Specs Expert Opinion "
https://www.carwale.com/tata-cars/tiago-ev/#variants,"Tata Tiago EV Price - Images, Colours & Reviews - CarWale","Tata Tiago EV Price - Images, Colours & Reviews - CarWale NEW CARS USED CARS REVIEWS & NEWS AD Tata Tiago EV 3.8 Expert Rating | 4.5 User Rating (206) Rate & Win The Tata Tiago EV is an electric hatchback for city driving. It is easy on your wallet and lets you pick how far you want to go with different battery sizes. Plus, it has multiple charging options and keeps you covered with an extensive feature list. ...more Overview 360째 View Variants Offers Key Specs Expert Opinion Similar Cars Colour"
https://www.carwale.com/mahindra-cars/be-6/,"Mahindra BE 6E Price - Images, Colours & Reviews - CarWale","Mahindra BE 6E Price - Images, Colours & Reviews - CarWale NEW CARS USED CARS REVIEWS & NEWS AD Mahindra BE 6 3.8 Expert Rating | 4.7 User Rating (203) Rate & Win The BE 6 is Mahindra's first born-electric vehicle, built on an advanced INGLO platform designed for electric vehicles. It is a new coupe-style SUV that combines the latest technology with high efficiency and strong performance. ...more Overview Variants Offers Similar Cars Colours Brochure Range User Reviews News Expert Reviews Videos"
https://www.carwale.com/tata-cars/nexon-ev/,"Tata Nexon EV Price - Images, Colours & Reviews - CarWale","Tata Nexon EV Price - Images, Colours & Reviews - CarWale NEW CARS USED CARS REVIEWS & NEWS AD Tata Nexon EV 3.7 Expert Rating | 4.3 User Rating (130) Rate & Win The Nexon EV, an electric SUV, has impressive range, swift acceleration, and ample interior space. Apart from that, the good ride and handling, sleek design, fast charging capability, and advanced features like regenerative braking make it a compelling choice. ...more Overview 360째 View Variants Offers Similar Cars Colours Brochure Rang"
https://www.carwale.com/mahindra-cars/xev-9e/,"Mahindra XEV 9e Price - Images, Colours & Reviews - CarWale","Mahindra XEV 9e Price - Images, Colours & Reviews - CarWale NEW CARS USED CARS REVIEWS & NEWS AD Mahindra XEV 9e 3.9 Expert Rating | 4.8 User Rating (83) Rate & Win The XEV 9e is be a brand-new coupe SUV underpinned by the new Born Electric vehicle INGLO platform. It is loaded with many segment-leading features. The electric coupe SUV has been launched with an introductory price tag of Rs. 21.9 lakh (ex-showroom). ...more Overview Variants Offers Similar Cars Colours Brochure Range User Reviews "
